{
  "schemaVersion": 1,
  "generatedBy": "tools/render-v6.mjs",
  "files": [
    {
      "path": "integrations/claude-code.json",
      "normalization": "utf8-lf",
      "sha256": "1cd139165a0d9307cfcf32cd224be3a9ac5ae87891a0f9ef2ada0123462858df",
      "bytes": 383
    },
    {
      "path": "integrations/clients.json",
      "normalization": "utf8-lf",
      "sha256": "6eb0882bc25c14ead9e84b6e2ce5e14f4e54084c686ba58e6d92d87bfaf26ba6",
      "bytes": 2098
    },
    {
      "path": "integrations/payload-history.json",
      "normalization": "utf8-lf",
      "sha256": "b715e1a8eb81a8bca579c416c1c7c3e5b0bbca40d8a567e6a500466023ddf9ac",
      "bytes": 221407
    },
    {
      "path": "integrations/reviewer.md",
      "normalization": "utf8-lf",
      "sha256": "668cede3801696ba601ad846186c0fbc5f31ae306d2acb56e14aa8dcf6607978",
      "bytes": 1318
    },
    {
      "path": "kernel/block.md",
      "normalization": "utf8-lf",
      "sha256": "54bbc10adc05fd412d796f033bd31bca48119437a5a2bf2bb251f58472f147a4",
      "bytes": 222
    },
    {
      "path": "kernel/clauses/ui-interaction.md",
      "normalization": "utf8-lf",
      "sha256": "30f17cfdf7547a35b98a10cd045befdd0c641b690138024013306af9ee61d9ab",
      "bytes": 496
    },
    {
      "path": "kernel/contract.md",
      "normalization": "utf8-lf",
      "sha256": "65f72fc286f49d43908c3bfc5245134348e67c181476b8bfa2cc225ce7410441",
      "bytes": 5610
    },
    {
      "path": "kernel/profiles/high-assurance.md",
      "normalization": "utf8-lf",
      "sha256": "331a61124dd575828d68da66ae7a6565925e1fc4f93ca35d39f5401d64999d84",
      "bytes": 781
    },
    {
      "path": "kernel/profiles/prototype.md",
      "normalization": "utf8-lf",
      "sha256": "ea7179806b491cd294e14375b2849fb1f87dd55c96cb1ed9000980d5b38d3e28",
      "bytes": 672
    },
    {
      "path": "kernel/profiles/standard.md",
      "normalization": "utf8-lf",
      "sha256": "28e3811ff4f3d849bbf5e41a4e605d4c81927df468559f93903a706853b802f1",
      "bytes": 745
    },
    {
      "path": "kernel/thresholds.json",
      "normalization": "utf8-lf",
      "sha256": "da512b3b94ff666f2d5f385eb7aca30256c497d001d1e6698800223cdec77f22",
      "bytes": 1260
    },
    {
      "path": "schemas/aer-lock.schema.json",
      "normalization": "utf8-lf",
      "sha256": "5a2df5a2ad5573b1fb7baf6a3faaad0b53734689ec5140dddbff45c6bcc7b95f",
      "bytes": 8722
    },
    {
      "path": "schemas/output.schema.json",
      "normalization": "utf8-lf",
      "sha256": "18ab828696b9aaf0b3798596f6cddb9106c9d9d9cae2990fd2f56255ee128bb6",
      "bytes": 5556
    },
    {
      "path": "schemas/payload-manifest.schema.json",
      "normalization": "utf8-lf",
      "sha256": "6d3e3f897fd4ad26d739d6266aee79730fa084349fa3968e8ba4cc6402ae55c2",
      "bytes": 1258
    },
    {
      "path": "skills/aer-building-backend-apis/references/backend-api.md",
      "normalization": "utf8-lf",
      "sha256": "93f60082648981db6431b39a276b74662b7d33da2d1cab9ffd5352333d188276",
      "bytes": 2186
    },
    {
      "path": "skills/aer-building-backend-apis/references/security.md",
      "normalization": "utf8-lf",
      "sha256": "bed412c952d9b19ff8bc58dc8591f3a4aa52fda5d9e84863f021a38cfced2628",
      "bytes": 2626
    },
    {
      "path": "skills/aer-building-backend-apis/SKILL.md",
      "normalization": "utf8-lf",
      "sha256": "c87bd62bfe202a25bb8946ae7d517aa8a019ff39278129b6dfa430a61c1387c3",
      "bytes": 1121
    },
    {
      "path": "skills/aer-building-web-ui/references/typescript-react.md",
      "normalization": "utf8-lf",
      "sha256": "e18cd0c3c53ec7cd2e201e036c03e43358a12c5a9d4b4d7d344c454a1aa675d6",
      "bytes": 2202
    },
    {
      "path": "skills/aer-building-web-ui/references/ui-styling.md",
      "normalization": "utf8-lf",
      "sha256": "f0a70bed992eb5737419611dffa6b43cadebacd2248ac6ce4c1ff2c7bb1227aa",
      "bytes": 1204
    },
    {
      "path": "skills/aer-building-web-ui/references/web-ui.md",
      "normalization": "utf8-lf",
      "sha256": "c5a64dbe96e1fb51f074d25f73fc2dbfb70d8a89cca5e05aa8d6d7345c728d54",
      "bytes": 5171
    },
    {
      "path": "skills/aer-building-web-ui/scripts/contrast-check.mjs",
      "normalization": "utf8-lf",
      "sha256": "05c5349cffe78c81f27dd762b4f362d62340f7faab208ee40f1ac56ec68b9616",
      "bytes": 11678
    },
    {
      "path": "skills/aer-building-web-ui/SKILL.md",
      "normalization": "utf8-lf",
      "sha256": "6b85ae7986678b2a3442a6c59feddd2f6c32cdcc4ddb04ce9084df17a23f5615",
      "bytes": 2699
    },
    {
      "path": "skills/aer-changing-data/references/database-migrations.md",
      "normalization": "utf8-lf",
      "sha256": "b9e3b46230b9a568adedce0ec4a798ad07490ae55002eb891e98250c5f07ff22",
      "bytes": 2644
    },
    {
      "path": "skills/aer-changing-data/references/security.md",
      "normalization": "utf8-lf",
      "sha256": "bed412c952d9b19ff8bc58dc8591f3a4aa52fda5d9e84863f021a38cfced2628",
      "bytes": 2626
    },
    {
      "path": "skills/aer-changing-data/references/testing.md",
      "normalization": "utf8-lf",
      "sha256": "b1ced563390d3ee94e44c5ed5adb6e9035a826ae16288ed2c60737e841722a87",
      "bytes": 3111
    },
    {
      "path": "skills/aer-changing-data/SKILL.md",
      "normalization": "utf8-lf",
      "sha256": "ab34289571cb3f90fd7a0b065974c32f3dcbc6759870a981c2355dd8cc963339",
      "bytes": 1554
    },
    {
      "path": "skills/aer-designing-code/references/boundaries.md",
      "normalization": "utf8-lf",
      "sha256": "5c27338c9a2f227f5dfd3b7330e7958d2938d8e7c95c3f7a1e208ff02273b118",
      "bytes": 1272
    },
    {
      "path": "skills/aer-designing-code/references/decision-making.md",
      "normalization": "utf8-lf",
      "sha256": "f2b0116260994f2b43217c21dcf6c2d2a30ca5d88452a2282d2b5c1fd9923212",
      "bytes": 1912
    },
    {
      "path": "skills/aer-designing-code/references/design-checkpoint.md",
      "normalization": "utf8-lf",
      "sha256": "a5d8d6109956bc30f0ad65933387b0819cb1081a2d1aa4d7b90be74c034143db",
      "bytes": 1521
    },
    {
      "path": "skills/aer-designing-code/references/errors-and-side-effects.md",
      "normalization": "utf8-lf",
      "sha256": "dc13f69a1dc8f379353105a8ed99d1e508e8c99b127f26e7be7eff3f527c8412",
      "bytes": 2163
    },
    {
      "path": "skills/aer-designing-code/references/observability.md",
      "normalization": "utf8-lf",
      "sha256": "7c554f22a74a4fb936f6545e7879f53d42405c40b4866c4dc9e1a351f9e35249",
      "bytes": 1482
    },
    {
      "path": "skills/aer-designing-code/references/performance.md",
      "normalization": "utf8-lf",
      "sha256": "7cd1ef3b377307bee3fc182282452ea1284ec615c5322aef860b9e769a1f962a",
      "bytes": 1772
    },
    {
      "path": "skills/aer-designing-code/references/principles.md",
      "normalization": "utf8-lf",
      "sha256": "9ea25b8c777b00377568ca9a1dc403a47a5f1e099df5d15647f7600be8e02f35",
      "bytes": 1016
    },
    {
      "path": "skills/aer-designing-code/references/types-and-state.md",
      "normalization": "utf8-lf",
      "sha256": "b34f082494921b35b1451b6eb9b873d7fa063a93e539233ea9e0a7bc2fc4eef0",
      "bytes": 1204
    },
    {
      "path": "skills/aer-designing-code/SKILL.md",
      "normalization": "utf8-lf",
      "sha256": "0cb872bc45c109fb31507f54b2afc844bc4fc94da37a884be3328eb9c987be75",
      "bytes": 1321
    },
    {
      "path": "skills/aer-fixing-bugs/references/errors-and-side-effects.md",
      "normalization": "utf8-lf",
      "sha256": "dc13f69a1dc8f379353105a8ed99d1e508e8c99b127f26e7be7eff3f527c8412",
      "bytes": 2163
    },
    {
      "path": "skills/aer-fixing-bugs/references/testing.md",
      "normalization": "utf8-lf",
      "sha256": "b1ced563390d3ee94e44c5ed5adb6e9035a826ae16288ed2c60737e841722a87",
      "bytes": 3111
    },
    {
      "path": "skills/aer-fixing-bugs/references/verification.md",
      "normalization": "utf8-lf",
      "sha256": "069895656b360437cbd87fb2695eaf50e653cb6949c8db6d9946ad29c6ba46a0",
      "bytes": 3203
    },
    {
      "path": "skills/aer-fixing-bugs/SKILL.md",
      "normalization": "utf8-lf",
      "sha256": "6887e0679e7f2158ed3971d802ce1b4053474d3b14860a453ec66d954b4a2903",
      "bytes": 1757
    },
    {
      "path": "skills/aer-implementing-features/references/design-checkpoint.md",
      "normalization": "utf8-lf",
      "sha256": "a5d8d6109956bc30f0ad65933387b0819cb1081a2d1aa4d7b90be74c034143db",
      "bytes": 1521
    },
    {
      "path": "skills/aer-implementing-features/references/implementation.md",
      "normalization": "utf8-lf",
      "sha256": "248da33d996a348f0cb9e4a19ffc16bb6216f46b0cd1c48b82a3717421f5bf1a",
      "bytes": 2105
    },
    {
      "path": "skills/aer-implementing-features/references/verification.md",
      "normalization": "utf8-lf",
      "sha256": "069895656b360437cbd87fb2695eaf50e653cb6949c8db6d9946ad29c6ba46a0",
      "bytes": 3203
    },
    {
      "path": "skills/aer-implementing-features/SKILL.md",
      "normalization": "utf8-lf",
      "sha256": "8decbf05b713bc68746dff22837238a653eea6459a4da590e932f72203940091",
      "bytes": 2421
    },
    {
      "path": "skills/aer-refactoring-code/references/boundaries.md",
      "normalization": "utf8-lf",
      "sha256": "5c27338c9a2f227f5dfd3b7330e7958d2938d8e7c95c3f7a1e208ff02273b118",
      "bytes": 1272
    },
    {
      "path": "skills/aer-refactoring-code/references/principles.md",
      "normalization": "utf8-lf",
      "sha256": "9ea25b8c777b00377568ca9a1dc403a47a5f1e099df5d15647f7600be8e02f35",
      "bytes": 1016
    },
    {
      "path": "skills/aer-refactoring-code/references/testing.md",
      "normalization": "utf8-lf",
      "sha256": "b1ced563390d3ee94e44c5ed5adb6e9035a826ae16288ed2c60737e841722a87",
      "bytes": 3111
    },
    {
      "path": "skills/aer-refactoring-code/references/types-and-state.md",
      "normalization": "utf8-lf",